{
  "$schema": "https://json-schema.org/draft/2020-12/schema",
  "$id": "https://example.local/lee-agent/config.schema.json",
  "title": "Lee-Agent runtime config",
  "type": "object",
  "additionalProperties": true,
  "properties": {
    "task": {
      "type": "object",
      "additionalProperties": false,
      "properties": {
        "title": { "type": "string" },
        "issue": { "type": "string" },
        "description": { "type": "string" }
      }
    },
    "repo_path": { "type": "string" },
    "repo": { "type": "string" },
    "max_loops": { "type": "integer", "minimum": 1 },
    "trace_dir": { "type": "string" },
    "execution_enabled": { "type": "boolean" },
    "execution_env": { "type": "object", "additionalProperties": { "type": "string" } },
    "execution_timeout": { "type": "integer", "minimum": 10, "maximum": 1800 },
    "execution_model_calls": { "type": "integer", "minimum": 1, "maximum": 64 },
    "execution_tool_calls": { "type": "integer", "minimum": 1, "maximum": 128 },
    "execution_retries": { "type": "integer", "minimum": 0, "maximum": 32 },
    "execution_startup_timeout": { "type": "integer", "minimum": 1, "maximum": 120 },
    "execution_operation_timeout": { "type": "integer", "minimum": 1, "maximum": 300 },
    "execution_cleanup_timeout": { "type": "integer", "minimum": 1, "maximum": 30 },
    "execution_resources": {
      "type": "object", "additionalProperties": false,
      "properties": {
        "memory_limit_mb": { "type": "integer", "minimum": 64, "maximum": 1048576 },
        "cpu_limit_percent": { "type": "integer", "minimum": 1, "maximum": 100 },
        "max_processes": { "type": "integer", "minimum": 8, "maximum": 4096 },
        "mode": { "enum": ["strict", "best_effort"] }
      }
    },
    "require_step_approval": { "type": "boolean" },
    "step_approval": { "type": "boolean" },
    "env_file": { "type": ["string", "null"] },
    "env_override": { "type": "boolean" },
    "manifest_dir": { "type": ["string", "null"] },
    "logging": {
      "type": "object",
      "additionalProperties": false,
      "properties": {
        "level": {
          "type": "string",
          "enum": ["TRACE", "DEBUG", "INFO", "SUCCESS", "WARNING", "ERROR", "CRITICAL"]
        },
        "file": { "type": ["string", "null"] },
        "json": { "type": "boolean" },
        "to_console": { "type": "boolean" }
      }
    },
    "llm": {
      "type": "object",
      "additionalProperties": false,
      "properties": {
        "provider": { "$ref": "#/$defs/provider" },
        "model": { "type": "string" },
        "api_base": { "type": "string" },
        "api_key_env": { "type": "string" },
        "timeout": { "type": "integer", "minimum": 1 },
        "temperature": { "type": "number" },
        "max_output_chars": { "type": "integer", "minimum": 1 },
        "response_format_mode": { "type": "string", "enum": ["auto", "native", "json"] },
        "structured_fallback": { "type": "boolean" },
        "max_retries": { "type": "integer", "minimum": 0 },
        "max_completion_tokens": { "type": ["integer", "null"], "minimum": 1 },
        "reasoning_effort": { "type": ["string", "null"], "minLength": 1 },
        "extra_body": { "type": "object" },
        "context_compressor": { "$ref": "#/$defs/llmConfig" },
        "context": { "$ref": "#/$defs/llmConfig" },
        "plan": { "$ref": "#/$defs/llmConfig" },
        "planner": { "$ref": "#/$defs/llmConfig" },
        "action": { "$ref": "#/$defs/llmConfig" },
        "action_policy": { "$ref": "#/$defs/llmConfig" },
        "task_analysis": { "$ref": "#/$defs/llmConfig" },
        "observer": { "$ref": "#/$defs/llmConfig" },
        "memory_extractor": { "$ref": "#/$defs/llmConfig" },
        "memory_relation": { "$ref": "#/$defs/llmConfig" },
        "code_context_query": { "$ref": "#/$defs/llmConfig" },
        "code_context_rerank": { "$ref": "#/$defs/llmConfig" },
        "skill_selector": { "$ref": "#/$defs/llmConfig" },
        "final_reporter": { "$ref": "#/$defs/llmConfig" },
        "completion_judge": { "$ref": "#/$defs/llmConfig" }
      }
    },
    "modes": {
      "type": "object",
      "additionalProperties": false,
      "properties": {
        "planner": { "enum": ["heuristic", "llm"] },
        "context_compressor": { "enum": ["disabled", "rule_based", "llm"] },
        "action_policy": { "enum": ["heuristic", "rl", "llm"] },
        "task_analyzer": { "enum": ["disabled", "llm"] },
        "observer": { "enum": ["disabled", "llm"] },
        "code_context_query_planner": { "enum": ["disabled", "llm"] },
        "code_context_reranker": { "enum": ["disabled", "llm"] },
        "skill_selector": { "enum": ["disabled", "llm"] },
        "final_reporter": { "enum": ["rule_based", "llm"] },
        "completion_judge": { "enum": ["auto", "rule_based", "llm"] }
      }
    },
    "memory": {
      "type": "object",
      "additionalProperties": false,
      "properties": {
        "path": { "type": "string" },
        "max_turns": { "type": "integer", "minimum": 1 },
        "max_chars": { "type": "integer", "minimum": 1000 },
        "file_cache_max_files": { "type": "integer", "minimum": 1 },
        "file_cache_max_spans": { "type": "integer", "minimum": 1 },
        "file_cache_max_bytes": { "type": "integer", "minimum": 1 }
      }
    },
    "archive": {
      "type": "object",
      "additionalProperties": false,
      "properties": {
        "enabled": { "type": "boolean" },
        "path": { "type": "string" },
        "max_text_chars": { "type": "integer", "minimum": 1000 },
        "max_source_file_bytes": { "type": "integer", "minimum": 1 },
        "max_source_total_bytes": { "type": "integer", "minimum": 1 }
      }
    },
    "long_term_memory": {
      "type": "object",
      "additionalProperties": false,
      "properties": {
        "document_path": { "type": "string", "minLength": 1 },
        "catalog_path": { "type": "string", "minLength": 1 },
        "semantic_index_path": { "type": "string", "minLength": 1 },
        "catalog_busy_timeout_ms": { "type": "integer", "minimum": 1 },
        "keyword_candidate_multiplier": { "type": "integer", "minimum": 1, "maximum": 100 },
        "retrieval_enabled": { "type": "boolean" },
        "retrieval_mode": { "enum": ["keyword"] },
        "retrieval_limit": { "type": "integer", "minimum": 1, "maximum": 100 },
        "retrieval_max_chars": { "type": "integer", "minimum": 1000 },
        "retrieval_min_score": { "type": "number", "minimum": 0, "maximum": 1 },
        "retrieval_include_draft": { "type": "boolean" },
        "retrieval_max_refreshes": { "type": "integer", "minimum": 1, "maximum": 10 },
        "retrieval_max_queries": { "type": "integer", "minimum": 1, "maximum": 8 },
        "retrieval_type_limits": {
          "type": "object",
          "additionalProperties": false,
          "properties": {
            "preference": { "type": "integer", "minimum": 0 },
            "semantic": { "type": "integer", "minimum": 0 },
            "procedural": { "type": "integer", "minimum": 0 },
            "anti_pattern": { "type": "integer", "minimum": 0 },
            "episodic": { "type": "integer", "minimum": 0 }
          }
        },
        "consolidation_path": { "type": "string", "minLength": 1 },
        "pipeline_version": { "type": "string", "minLength": 1 },
        "extractor_mode": { "enum": ["rule_based", "llm"] },
        "max_candidates": { "type": "integer", "minimum": 1, "maximum": 100 },
        "semantic_merge_mode": { "enum": ["disabled", "observe", "apply"] },
        "semantic_top_k": { "type": "integer", "minimum": 1, "maximum": 20 },
        "semantic_min_similarity": { "type": "number", "minimum": 0, "maximum": 1 },
        "semantic_relation_min_confidence": { "type": "number", "minimum": 0, "maximum": 1 },
        "embedding": { "$ref": "#/$defs/embeddingConfig" }
      }
    },
    "context": {
      "type": "object",
      "additionalProperties": false,
      "properties": {
        "enabled": { "type": "boolean" },
        "compression_enabled": { "type": "boolean" },
        "compressor_mode": { "enum": ["disabled", "rule_based", "llm"] },
        "max_tokens": { "type": "integer", "minimum": 1 },
        "compression_threshold": { "type": "number", "exclusiveMinimum": 0 },
        "compression_target": { "type": "number", "exclusiveMinimum": 0, "exclusiveMaximum": 1 },
        "recent_items": { "type": "integer", "minimum": 1 },
        "min_new_tokens": { "type": "integer", "minimum": 1 }
      }
    },
    "observer": {
      "type": "object",
      "additionalProperties": false,
      "properties": {
        "use_delta": { "type": "boolean" },
        "full_state_on_severe": { "type": "boolean" },
        "write_threshold": { "type": "number", "minimum": 0, "maximum": 1 },
        "store_limit": { "type": "integer", "minimum": 1 }
      }
    },
    "code_context": {
      "type": "object",
      "additionalProperties": false,
      "properties": {
        "index_path": { "type": "string" },
        "query_limit": { "type": "integer", "minimum": 1 },
        "selected_limit": { "type": "integer", "minimum": 1 },
        "rerank_candidate_limit": { "type": "integer", "minimum": 1 }
      }
    },
    "skill": {
      "type": "object",
      "additionalProperties": false,
      "properties": {
        "selected_limit": { "type": "integer", "minimum": 1 }
      }
    },
    "rl": {
      "type": "object",
      "additionalProperties": false,
      "properties": {
        "enabled": { "type": "boolean" },
        "q_table_path": { "type": "string" },
        "replay_path": { "type": "string" },
        "epsilon": { "type": "number", "minimum": 0 },
        "learning_rate": { "type": "number", "minimum": 0 },
        "discount": { "type": "number", "minimum": 0 },
        "replay_max_size": { "type": "integer", "minimum": 1 },
        "train_batch_size": { "type": "integer", "minimum": 1 }
      }
    },
    "editing": {
      "type": "object",
      "additionalProperties": false,
      "properties": {
        "enabled": { "type": "boolean" },
        "max_files": { "type": "integer", "minimum": 1 },
        "max_changed_lines": { "type": "integer", "minimum": 1 },
        "max_file_bytes": { "type": "integer", "minimum": 1 },
        "require_read_before_write": { "type": "boolean" },
        "confidence_threshold": { "type": "number", "minimum": 0, "maximum": 1 },
        "allow_create": { "type": "boolean" }
      }
    },
    "approval": {
      "type": "object",
      "additionalProperties": false,
      "properties": {
        "require_step_approval": { "type": "boolean" },
        "step_approval": { "type": "boolean" },
        "each_step": { "type": "boolean" }
      }
    }
  },
  "$defs": {
    "llmConfig": {
      "type": "object",
      "additionalProperties": false,
      "properties": {
        "provider": { "$ref": "#/$defs/provider" },
        "model": { "type": "string" },
        "api_base": { "type": "string" },
        "api_key_env": { "type": "string" },
        "timeout": { "type": "integer", "minimum": 1 },
        "temperature": { "type": "number" },
        "max_output_chars": { "type": "integer", "minimum": 1 },
        "response_format_mode": { "type": "string", "enum": ["auto", "native", "json"] },
        "structured_fallback": { "type": "boolean" },
        "max_retries": { "type": "integer", "minimum": 0 },
        "max_completion_tokens": { "type": ["integer", "null"], "minimum": 1 },
        "reasoning_effort": { "type": ["string", "null"], "minLength": 1 },
        "extra_body": { "type": "object" }
      }
    },
    "embeddingConfig": {
      "type": "object",
      "additionalProperties": false,
      "properties": {
        "provider": { "$ref": "#/$defs/provider" },
        "model": { "type": "string" },
        "api_base": { "type": "string" },
        "api_key_env": { "type": "string" },
        "timeout": { "type": "integer", "minimum": 1 },
        "dimensions": { "type": "integer", "minimum": 0 },
        "batch_size": { "type": "integer", "minimum": 1 }
      }
    },
    "provider": {
      "type": "string",
      "enum": ["", "disabled", "none", "openai", "openai_compatible", "openai-compatible", "enable"]
    }
  }
}
